PMID,Title,Authors,Citation,First Author,Journal/Book,Publication Year,Create Date,PMCID,NIHMS ID,DOI
"36711739","ADAPTIVE TIME LOCATION SAMPLING FOR COMPASS, A SARS-COV-2 PREVALENCE STUDY IN FIFTEEN DIVERSE COMMUNITIES IN THE UNITED STATES","Zangeneh SZ, Skalland T, Yuhas K, Emel L, De Dieu Tapsoba J, Reed D, Amos CI, Donnell D, Moore A, Justman J; CoVPN 5002 Study Team.","medRxiv. 2023 Jan 11:2023.01.10.23284400. doi: 10.1101/2023.01.10.23284400. Preprint.","Zangeneh SZ","medRxiv","2023","2023/01/30","PMC9882424","","10.1101/2023.01.10.23284400"
"36332654","Projected outcomes of universal testing and treatment in a generalised HIV epidemic in Zambia and South Africa (the HPTN 071 [PopART] trial): a modelling study","Probert WJM, Sauter R, Pickles M, Cori A, Bell-Mandla NF, Bwalya J, Abeler-Dörner L, Bock P, Donnell DJ, Floyd S, Macleod D, Piwowar-Manning E, Skalland T, Shanaube K, Wilson E, Yang B, Ayles H, Fidler S, Hayes RJ, Fraser C; HPTN 071 (PopART) Study Team.","Lancet HIV. 2022 Nov;9(11):e771-e780. doi: 10.1016/S2352-3018(22)00259-4.","Probert WJM","Lancet HIV","2022","2022/11/04","PMC9646978","","10.1016/S2352-3018(22)00259-4"
"31314965","Effect of Universal Testing and Treatment on HIV Incidence - HPTN 071 (PopART)","Hayes RJ, Donnell D, Floyd S, Mandla N, Bwalya J, Sabapathy K, Yang B, Phiri M, Schaap A, Eshleman SH, Piwowar-Manning E, Kosloff B, James A, Skalland T, Wilson E, Emel L, Macleod D, Dunbar R, Simwinga M, Makola N, Bond V, Hoddinott G, Moore A, Griffith S, Deshmane Sista N, Vermund SH, El-Sadr W, Burns DN, Hargreaves JR, Hauck K, Fraser C, Shanaube K, Bock P, Beyers N, Ayles H, Fidler S; HPTN 071 (PopART) Study Team.","N Engl J Med. 2019 Jul 18;381(3):207-218. doi: 10.1056/NEJMoa1814556.","Hayes RJ","N Engl J Med","2019","2019/07/18","PMC6587177","","10.1056/NEJMoa1814556"
"36332653","Impact of universal testing and treatment on sexual risk behaviour and herpes simplex virus type 2: a prespecified secondary outcomes analysis of the HPTN 071 (PopART) community-randomised trial","Wilson E, Donnell D, Skalland T, Floyd S, Moore A, Bell-Mandla N, Bwalya J, Kasese N, Dunbar R, Shanaube K, Kosloff B, Laeyendecker O, Agyei Y, Hoddinott G, Bock P, Fidler S, Hayes R, Ayles H; HPTN 071 (PopART) Study Team.","Lancet HIV. 2022 Nov;9(11):e760-e770. doi: 10.1016/S2352-3018(22)00253-3.","Wilson E","Lancet HIV","2022","2022/11/04","PMC9646971","","10.1016/S2352-3018(22)00253-3"
"36332652","Viral suppression and self-reported ART adherence after 3 years of universal testing and treatment in the HPTN 071 (PopART) community-randomised trial in Zambia and South Africa: a cross-sectional analysis","Macleod D, Shanaube K, Skalland T, Limbada M, Mandla N, Bwalya J, Schaap A, Yang B, Donnell D, Piwowar-Manning E, Eshleman SH, Hoddinott G, Bond V, Moore A, Griffith S, Bock P, Ayles H, Fidler S, Hayes R, Floyd S; HPTN 071 (PopART) Study Team.","Lancet HIV. 2022 Nov;9(11):e751-e759. doi: 10.1016/S2352-3018(22)00237-5.","Macleod D","Lancet HIV","2022","2022/11/04","PMC9646982","","10.1016/S2352-3018(22)00237-5"
"37450436","Population-level viremia predicts HIV incidence at the community level across the Universal Testing and Treatment Trials in eastern and southern Africa","Larmarange J, Bachanas P, Skalland T, Balzer LB, Iwuji C, Floyd S, Mills LA, Pillay D, Havlir D, Kamya MR, Ayles H, Wirth K, Dabis F, Hayes R, Petersen M; UT³C consortium.","PLOS Glob Public Health. 2023 Jul 14;3(7):e0002157. doi: 10.1371/journal.pgph.0002157. eCollection 2023.","Larmarange J","PLOS Glob Public Health","2023","2023/07/14","PMC10348573","","10.1371/journal.pgph.0002157"
