PMID,Title,Authors,Citation,First Author,Journal/Book,Publication Year,Create Date,PMCID,NIHMS ID,DOI
"35933992","Multi-omics personalized network analyses highlight progressive disruption of central metabolism associated with COVID-19 severity","Ambikan AT, Yang H, Krishnan S, Svensson Akusjärvi S, Gupta S, Lourda M, Sperk M, Arif M, Zhang C, Nordqvist H, Ponnan SM, Sönnerborg A, Treutiger CJ, O'Mahony L, Mardinoglu A, Benfeitas R, Neogi U.","Cell Syst. 2022 Aug 17;13(8):665-681.e4. doi: 10.1016/j.cels.2022.06.006. Epub 2022 Jul 8.","Ambikan AT","Cell Syst","2022","2022/08/07","PMC9263811","","10.1016/j.cels.2022.06.006"
"34619366","Metabolic Perturbation Associated With COVID-19 Disease Severity and SARS-CoV-2 Replication","Krishnan S, Nordqvist H, Ambikan AT, Gupta S, Sperk M, Svensson-Akusjärvi S, Mikaeloff F, Benfeitas R, Saccon E, Ponnan SM, Rodriguez JE, Nikouyan N, Odeh A, Ahlén G, Asghar M, Sällberg M, Vesterbacka J, Nowak P, Végvári Á, Sönnerborg A, Treutiger CJ, Neogi U.","Mol Cell Proteomics. 2021;20:100159. doi: 10.1016/j.mcpro.2021.100159. Epub 2021 Oct 5.","Krishnan S","Mol Cell Proteomics","2021","2021/10/07","PMC8490130","","10.1016/j.mcpro.2021.100159"
"33659876","Distinct lipid profile, low-level inflammation, and increased antioxidant defense signature in HIV-1 elite control status","Sperk M, Mikaeloff F, Svensson-Akusjärvi S, Krishnan S, Ponnan SM, Ambikan AT, Nowak P, Sönnerborg A, Neogi U.","iScience. 2021 Jan 28;24(2):102111. doi: 10.1016/j.isci.2021.102111. eCollection 2021 Feb 19.","Sperk M","iScience","2021","2021/03/04","PMC7892918","","10.1016/j.isci.2021.102111"
"33936106","Role of Circulating T Follicular Helper Cells and Stem-Like Memory CD4(+) T Cells in the Pathogenesis of HIV-2 Infection and Disease Progression","Ponnan SM, Vidyavijayan KK, Thiruvengadam K, Hilda J N, Mathayan M, Murugavel KG, Hanna LE.","Front Immunol. 2021 Apr 16;12:666388. doi: 10.3389/fimmu.2021.666388. eCollection 2021.","Ponnan SM","Front Immunol","2021","2021/05/03","PMC8085399","","10.3389/fimmu.2021.666388"
"31877329","Molecular characterization of Enterococcus faecalis isolates from urinary tract infection and interaction between Enterococcus faecalis encountered Dendritic and Natural Killer cells","Kathirvel S, Mani M, Gopala Krishnan GK, Sethumadhavan A, Vijayalakshmi T, Ponnan SM, Hanna LE, Mathaiyan M.","Microb Pathog. 2020 Mar;140:103944. doi: 10.1016/j.micpath.2019.103944. Epub 2019 Dec 23.","Kathirvel S","Microb Pathog","2020","2019/12/27","","","10.1016/j.micpath.2019.103944"
