PMID,Title,Authors,Citation,First Author,Journal/Book,Publication Year,Create Date,PMCID,NIHMS ID,DOI
"16924216","The impact of comorbidities on the change in short-form 36 and oswestry scores following lumbar spine surgery","Slover J, Abdu WA, Hanscom B, Weinstein JN.","Spine (Phila Pa 1976). 2006 Aug 1;31(17):1974-80. doi: 10.1097/01.brs.0000229252.30903.b9.","Slover J","Spine (Phila Pa 1976)","2006","2006/08/23","","","10.1097/01.brs.0000229252.30903.b9"
"30191830","A scalable, integrated intervention to engage people who inject drugs in HIV care and medication-assisted treatment (HPTN 074): a randomised, controlled phase 3 feasibility and efficacy study","Miller WC, Hoffman IF, Hanscom BS, Ha TV, Dumchev K, Djoerban Z, Rose SM, Latkin CA, Metzger DS, Lancaster KE, Go VF, Dvoriak S, Mollan KR, Reifeis SA, Piwowar-Manning EM, Richardson P, Hudgens MG, Hamilton EL, Sugarman J, Eshleman SH, Susami H, Chu VA, Djauzi S, Kiriazova T, Bui DD, Strathdee SA, Burns DN.","Lancet. 2018 Sep 1;392(10149):747-759. doi: 10.1016/S0140-6736(18)31487-9.","Miller WC","Lancet","2018","2018/09/08","PMC6299325","NIHMS1506084","10.1016/S0140-6736(18)31487-9"
"17630138","Retrolisthesis and lumbar disc herniation: a preoperative assessment of patient function","Shen M, Razi A, Lurie JD, Hanscom B, Weinstein J.","Spine J. 2007 Jul-Aug;7(4):406-13. doi: 10.1016/j.spinee.2006.08.011. Epub 2007 Jan 2.","Shen M","Spine J","2007","2007/07/17","PMC2278018","NIHMS28387","10.1016/j.spinee.2006.08.011"
"12973155","Impact of neck and arm pain on overall health status","Daffner SD, Hilibrand AS, Hanscom BS, Brislin BT, Vaccaro AR, Albert TJ.","Spine (Phila Pa 1976). 2003 Sep 1;28(17):2030-5. doi: 10.1097/01.BRS.0000083325.27357.39.","Daffner SD","Spine (Phila Pa 1976)","2003","2003/09/16","","","10.1097/01.BRS.0000083325.27357.39"
"15770168","The rate and variation of referrals to behavioral medicine services for patients reporting poor mental health in the national spine network","Walsh TL, Hanscom B, Homa K, Abdu WA.","Spine (Phila Pa 1976). 2005 Mar 15;30(6):E154-60. doi: 10.1097/01.brs.0000155558.67266.e9.","Walsh TL","Spine (Phila Pa 1976)","2005","2005/03/17","","","10.1097/01.brs.0000155558.67266.e9"
"16712622","Cluster analysis of SF-36 scales as a predictor of spinal pain patients response to a multidisciplinary pain management approach beginning with epidural steroid injection","Loyd R, Fanciullo GJ, Hanscom B, Baird JC.","Pain Med. 2006 May-Jun;7(3):229-36. doi: 10.1111/j.1526-4637.2006.00158.x.","Loyd R","Pain Med","2006","2006/05/23","","","10.1111/j.1526-4637.2006.00158.x"
"16688042","Can condition-specific health surveys be specific to spine disease? An analysis of the effect of comorbidities on baseline condition-specific and general health survey scores","Slover J, Abdu WA, Hanscom B, Lurie J, Weinstein JN.","Spine (Phila Pa 1976). 2006 May 15;31(11):1265-71. doi: 10.1097/01.brs.0000217635.67693.40.","Slover J","Spine (Phila Pa 1976)","2006","2006/05/12","","","10.1097/01.brs.0000217635.67693.40"
"16868238","A controlled trial of methods for managing pain in primary care patients with or without co-occurring psychosocial problems","Ahles TA, Wasson JH, Seville JL, Johnson DJ, Cole BF, Hanscom B, Stukel TA, McKinstry E.","Ann Fam Med. 2006 Jul-Aug;4(4):341-50. doi: 10.1370/afm.527.","Ahles TA","Ann Fam Med","2006","2006/07/27","PMC1522168","","10.1370/afm.527"
