PMID,Title,Authors,Citation,First Author,Journal/Book,Publication Year,Create Date,PMCID,NIHMS ID,DOI
"34379922","Cabotegravir for HIV Prevention in Cisgender Men and Transgender Women","Landovitz RJ, Donnell D, Clement ME, Hanscom B, Cottle L, Coelho L, Cabello R, Chariyalertsak S, Dunne EF, Frank I, Gallardo-Cartagena JA, Gaur AH, Gonzales P, Tran HV, Hinojosa JC, Kallas EG, Kelley CF, Losso MH, Madruga JV, Middelkoop K, Phanuphak N, Santos B, Sued O, Valencia Huamaní J, Overton ET, Swaminathan S, Del Rio C, Gulick RM, Richardson P, Sullivan P, Piwowar-Manning E, Marzinke M, Hendrix C, Li M, Wang Z, Marrazzo J, Daar E, Asmelash A, Brown TT, Anderson P, Eshleman SH, Bryan M, Blanchette C, Lucas J, Psaros C, Safren S, Sugarman J, Scott H, Eron JJ, Fields SD, Sista ND, Gomez-Feliciano K, Jennings A, Kofron RM, Holtz TH, Shin K, Rooney JF, Smith KY, Spreen W, Margolis D, Rinehart A, Adeyeye A, Cohen MS, McCauley M, Grinsztejn B; HPTN 083 Study Team.","N Engl J Med. 2021 Aug 12;385(7):595-608. doi: 10.1056/NEJMoa2101016.","Landovitz RJ","N Engl J Med","2021","2021/08/11","PMC8448593","NIHMS1735236","10.1056/NEJMoa2101016"
"35378077","Cabotegravir for the prevention of HIV-1 in women: results from HPTN 084, a phase 3, randomised clinical trial","Delany-Moretlwe S, Hughes JP, Bock P, Ouma SG, Hunidzarira P, Kalonji D, Kayange N, Makhema J, Mandima P, Mathew C, Spooner E, Mpendo J, Mukwekwerere P, Mgodi N, Ntege PN, Nair G, Nakabiito C, Nuwagaba-Biribonwoha H, Panchia R, Singh N, Siziba B, Farrior J, Rose S, Anderson PL, Eshleman SH, Marzinke MA, Hendrix CW, Beigel-Orme S, Hosek S, Tolley E, Sista N, Adeyeye A, Rooney JF, Rinehart A, Spreen WR, Smith K, Hanscom B, Cohen MS, Hosseinipour MC; HPTN 084 study group.","Lancet. 2022 May 7;399(10337):1779-1789. doi: 10.1016/S0140-6736(22)00538-4. Epub 2022 Apr 1.","Delany-Moretlwe S","Lancet","2022","2022/04/04","PMC9077443","","10.1016/S0140-6736(22)00538-4"
"17538085","Surgical versus nonsurgical treatment for lumbar degenerative spondylolisthesis","Weinstein JN, Lurie JD, Tosteson TD, Hanscom B, Tosteson AN, Blood EA, Birkmeyer NJ, Hilibrand AS, Herkowitz H, Cammisa FP, Albert TJ, Emery SE, Lenke LG, Abdu WA, Longley M, Errico TJ, Hu SS.","N Engl J Med. 2007 May 31;356(22):2257-70. doi: 10.1056/NEJMoa070302.","Weinstein JN","N Engl J Med","2007","2007/06/01","PMC2553804","NIHMS67214","10.1056/NEJMoa070302"
"33740057","Characterization of Human Immunodeficiency Virus (HIV) Infection in Cisgender Men and Transgender Women Who Have Sex With Men Receiving Injectable Cabotegravir for HIV Prevention: HPTN 083","Marzinke MA, Grinsztejn B, Fogel JM, Piwowar-Manning E, Li M, Weng L, McCauley M, Cummings V, Ahmed S, Haines CD, Bushman LR, Petropoulos C, Persaud D, Adeyeye A, Kofron R, Rinehart A, St Clair M, Rooney JF, Pryluka D, Coelho L, Gaur A, Middelkoop K, Phanuphak N, Cohen MS, Hendrix CW, Anderson P, Hanscom B, Donnell D, Landovitz RJ, Eshleman SH.","J Infect Dis. 2021 Nov 16;224(9):1581-1592. doi: 10.1093/infdis/jiab152.","Marzinke MA","J Infect Dis","2021","2021/03/19","PMC8599849","","10.1093/infdis/jiab152"
"17119140","Surgical vs nonoperative treatment for lumbar disk herniation: the Spine Patient Outcomes Research Trial (SPORT): a randomized trial","Weinstein JN, Tosteson TD, Lurie JD, Tosteson AN, Hanscom B, Skinner JS, Abdu WA, Hilibrand AS, Boden SD, Deyo RA.","JAMA. 2006 Nov 22;296(20):2441-50. doi: 10.1001/jama.296.20.2441.","Weinstein JN","JAMA","2006","2006/11/23","PMC2553805","NIHMS67209","10.1001/jama.296.20.2441"
"18287602","Surgical versus nonsurgical therapy for lumbar spinal stenosis","Weinstein JN, Tosteson TD, Lurie JD, Tosteson AN, Blood E, Hanscom B, Herkowitz H, Cammisa F, Albert T, Boden SD, Hilibrand A, Goldberg H, Berven S, An H; SPORT Investigators.","N Engl J Med. 2008 Feb 21;358(8):794-810. doi: 10.1056/NEJMoa0707136.","Weinstein JN","N Engl J Med","2008","2008/02/22","PMC2576513","NIHMS67204","10.1056/NEJMoa0707136"
"35301540","Characterization of Human Immunodeficiency Virus (HIV) Infections in Women Who Received Injectable Cabotegravir or Tenofovir Disoproxil Fumarate/Emtricitabine for HIV Prevention: HPTN 084","Eshleman SH, Fogel JM, Piwowar-Manning E, Chau G, Cummings V, Agyei Y, Richardson P, Sullivan P, Haines CD, Bushman LR, Petropoulos C, Persaud D, Kofron R, Hendrix CW, Anderson PL, Farrior J, Mellors J, Adeyeye A, Rinehart A, St Clair M, Ford S, Rooney JF, Mathew CA, Hunidzarira P, Spooner E, Mpendo J, Nair G, Cohen MS, Hughes JP, Hosseinipour M, Hanscom B, Delany-Moretlwe S, Marzinke MA.","J Infect Dis. 2022 May 16;225(10):1741-1749. doi: 10.1093/infdis/jiab576.","Eshleman SH","J Infect Dis","2022","2022/03/18","PMC9113509","","10.1093/infdis/jiab576"
"27429191","Design Issues in Transgender Studies","Hughes JP, Emel L, Hanscom B, Zangeneh S.","J Acquir Immune Defic Syndr. 2016 Aug 15;72 Suppl 3(Suppl 3):S248-51. doi: 10.1097/QAI.0000000000001077.","Hughes JP","J Acquir Immune Defic Syndr","2016","2016/07/19","PMC4955862","NIHMS786179","10.1097/QAI.0000000000001077"
"30293490","Adaptive non-inferiority margins under observable non-constancy","Hanscom B, Hughes JP, Williamson BD, Donnell D.","Stat Methods Med Res. 2019 Oct-Nov;28(10-11):3318-3332. doi: 10.1177/0962280218801134. Epub 2018 Oct 8.","Hanscom B","Stat Methods Med Res","2019","2018/10/09","PMC8128326","NIHMS1042638","10.1177/0962280218801134"
"29039265","HIV prevention trial design in an era of effective pre-exposure prophylaxis","Cutrell A, Donnell D, Dunn DT, Glidden DV, Grobler A, Hanscom B, Stancil BS, Meyer RD, Wang R, Cuffe RL.","HIV Clin Trials. 2017 Nov-Dec;18(5-6):177-188. doi: 10.1080/15284336.2017.1379676. Epub 2017 Oct 17.","Cutrell A","HIV Clin Trials","2017","2017/10/18","PMC6084772","EMS78899","10.1080/15284336.2017.1379676"
"34454678","Ethical issues in establishing the efficacy and safety of long-acting injectable pre-exposure prophylaxis for HIV prevention: the HPTN 083 trial","Sugarman J, Donnell DJ, Hanscom B, McCauley M, Grinsztejn B, Landovitz RJ.","Lancet HIV. 2021 Nov;8(11):e723-e728. doi: 10.1016/S2352-3018(21)00153-3. Epub 2021 Aug 26.","Sugarman J","Lancet HIV","2021","2021/08/29","","","10.1016/S2352-3018(21)00153-3"
"36053045","Evaluating group-sequential non-inferiority clinical trials following interim stopping: The HIV Prevention Trials Network 083 trial","Hanscom BS, Donnell DJ, Fleming TR, Hughes JP, McCauley M, Grinsztejn B, Landovitz RJ, Emerson SS.","Clin Trials. 2022 Dec;19(6):605-612. doi: 10.1177/17407745221118371. Epub 2022 Sep 2.","Hanscom BS","Clin Trials","2022","2022/09/02","PMC9691580","NIHMS1825497","10.1177/17407745221118371"
"28966842","A Randomized-Controlled Trial of Computer-based Prevention Counseling for HIV-Positive Persons (HPTN 065)","McKinstry LA, Zerbe A, Hanscom B, Farrior J, Kurth AE, Stanton J, Li M, Elion R, Leider J, Branson B, El-Sadr WM.","J AIDS Clin Res. 2017 Jul;8(7):714. doi: 10.4172/2155-6113.1000714. Epub 2017 Jul 26.","McKinstry LA","J AIDS Clin Res","2017","2017/10/03","PMC5619875","NIHMS902421","10.4172/2155-6113.1000714"
"36742268","Association between drug use and ART use among people living with HIV who inject drugs in Vietnam, Ukraine and Indonesia: results from HPTN 074","Ha TV, Hoffman IF, Miller WC, Mollan KR, Lancaster KE, Richardson P, Zeziulin O, Djoerban Z, Sripaipan T, Chu VA, Guo X, Hanscom B, Go VF.","J Subst Use. 2022;27(6):648-657. doi: 10.1080/14659891.2021.1989509. Epub 2022 Jan 10.","Ha TV","J Subst Use","2022","2023/02/06","PMC9897261","NIHMS1855206","10.1080/14659891.2021.1989509"
"31541541","Reported Participation Benefits in International HIV Prevention Research with People Who Inject Drugs","Sugarman J, Trumble I, Hamilton E, Sarasvita R, Dumchev K, Viet H, Hoffman I, Miller W, Hanscom B.","Ethics Hum Res. 2019 Sep;41(5):28-34. doi: 10.1002/eahr.500030.","Sugarman J","Ethics Hum Res","2019","2019/09/22","PMC8792865","NIHMS1770647","10.1002/eahr.500030"
"36240386","HIV RNA Screening Reduces Integrase Strand Transfer Inhibitor Resistance Risk in Persons Receiving Long-Acting Cabotegravir for HIV Prevention","Eshleman SH, Fogel JM, Halvas EK, Piwowar-Manning E, Marzinke MA, Kofron R, Wang Z, Mellors J, McCauley M, Rinehart AR, St Clair M, Adeyeye A, Hinojosa JC, Cabello R, Middelkoop K, Hanscom B, Cohen MS, Grinsztejn B, Landovitz RJ; HPTN 083 Study Team.","J Infect Dis. 2022 Dec 13;226(12):2170-2180. doi: 10.1093/infdis/jiac415.","Eshleman SH","J Infect Dis","2022","2022/10/14","PMC10205624","","10.1093/infdis/jiac415"
"33161564","Examining stigma, social support, and gender differences in unsuppressed HIV viral load among participants in HPTN 065","Maragh-Bass AC, Gamble T, El-Sadr WM, Hanscom B, Tolley EE.","J Behav Med. 2021 Apr;44(2):159-171. doi: 10.1007/s10865-020-00186-7. Epub 2020 Nov 8.","Maragh-Bass AC","J Behav Med","2021","2020/11/08","","","10.1007/s10865-020-00186-7"
"23639207","Cerebrospinal fluid norepinephrine and cognition in subjects across the adult age span","Wang LY, Murphy RR, Hanscom B, Li G, Millard SP, Petrie EC, Galasko DR, Sikkema C, Raskind MA, Wilkinson CW, Peskind ER.","Neurobiol Aging. 2013 Oct;34(10):2287-92. doi: 10.1016/j.neurobiolaging.2013.04.007. Epub 2013 Apr 30.","Wang LY","Neurobiol Aging","2013","2013/05/04","PMC3706572","NIHMS475539","10.1016/j.neurobiolaging.2013.04.007"
"33252489","Depressive symptoms and use of HIV care and medication-assisted treatment among people with HIV who inject drugs","Zeziulin O, Mollan KR, Shook-Sa BE, Hanscom B, Lancaster KE, Dumchev K, Go VF, Chu VA, Kiriazova T, Syarif Z, Dvoryak S, Reifeis SA, Hamilton E, Sarasvita R, Rose S, Richardson P, Clarke W, Latkin CA, Metzger DS, Hoffman IF, Miller WC.","AIDS. 2021 Mar 1;35(3):495-501. doi: 10.1097/QAD.0000000000002774.","Zeziulin O","AIDS","2021","2020/11/30","PMC7855840","NIHMS1656551","10.1097/QAD.0000000000002774"
"27846073","Brief Report: Preventing HIV-1 Infection in Women Using Oral Preexposure Prophylaxis: A Meta-analysis of Current Evidence","Hanscom B, Janes HE, Guarino PD, Huang Y, Brown ER, Chen YQ, Hammer SM, Gilbert PB, Donnell DJ.","J Acquir Immune Defic Syndr. 2016 Dec 15;73(5):606-608. doi: 10.1097/QAI.0000000000001160.","Hanscom B","J Acquir Immune Defic Syndr","2016","2016/11/16","PMC5175411","NIHMS809310","10.1097/QAI.0000000000001160"
"33025791","Exploring individual-level barriers to HIV medication adherence among men who have sex with men in the HIV Prevention Trials Network (HPTN 065) study","Maragh-Bass AC, Gamble T, El-Sadr WM, Hanscom B, Tolley EE.","AIDS Care. 2021 Nov;33(11):1404-1413. doi: 10.1080/09540121.2020.1828799. Epub 2020 Oct 7.","Maragh-Bass AC","AIDS Care","2021","2020/10/07","PMC9531319","NIHMS1837851","10.1080/09540121.2020.1828799"
"36844011","Estimating the impact of HIV PrEP regimens containing long-acting injectable cabotegravir or daily oral tenofovir disoproxil fumarate/emtricitabine among men who have sex with men in the United States: a mathematical modelling study for HPTN 083","Mitchell KM, Boily MC, Hanscom B, Moore M, Todd J, Paz-Bailey G, Wejnert C, Liu A, Donnell DJ, Grinsztejn B, Landovitz RJ, Dimitrov DT.","Lancet Reg Health Am. 2023 Jan 17;18:100416. doi: 10.1016/j.lana.2022.100416. eCollection 2023 Feb.","Mitchell KM","Lancet Reg Health Am","2023","2023/02/27","PMC9950652","","10.1016/j.lana.2022.100416"
"36346452","Multiple Infection and Human Immunodeficiency Virus Superinfection Among Persons who Inject Drugs in Indonesia and Ukraine","Palumbo PJ, Grant-McAuley W, Grabowski MK, Zhang Y, Richardson P, Piwowar-Manning E, Sharma D, Clarke W, Laeyendecker O, Rose S, Ha TV, Dumchev K, Djoerban Z, Redd A, Hanscom B, Hoffman I, Miller WC, Eshleman SH.","J Infect Dis. 2022 Dec 13;226(12):2181-2191. doi: 10.1093/infdis/jiac441.","Palumbo PJ","J Infect Dis","2022","2022/11/08","PMC10205628","","10.1093/infdis/jiac441"
"34458390","Engaging People Who Inject Drugs Living With HIV in Antiretroviral Treatment and Medication for Opioid Use Disorder: Extended Follow-up of HIV Prevention Trials Network (HPTN) 074","Lancaster KE, Mollan KR, Hanscom BS, Shook-Sa BE, Ha TV, Dumchev K, Djoerban Z, Rose SM, Latkin CA, Metzger DS, Go VF, Dvoriak S, Reifeis SA, Piwowar-Manning EM, Richardson P, Hudgens MG, Hamilton EL, Eshleman SH, Susami H, Chu VA, Djauzi S, Kiriazova T, Nhan DT, Burns DN, Miller WC, Hoffman IF.","Open Forum Infect Dis. 2021 May 29;8(8):ofab281. doi: 10.1093/ofid/ofab281. eCollection 2021 Aug.","Lancaster KE","Open Forum Infect Dis","2021","2021/08/30","PMC8391093","","10.1093/ofid/ofab281"
"37170118","Causes and risk factors of death among people who inject drugs in Indonesia, Ukraine and Vietnam: findings from HPTN 074 randomized trial","Dumchev K, Guo X, Ha TV, Djoerban Z, Zeziulin O, Go VF, Sarasvita R, Metzger DS, Latkin CA, Rose SM, Piwowar-Manning E, Richardson P, Hanscom B, Lancaster KE, Miller WC, Hoffman IF.","BMC Infect Dis. 2023 May 11;23(1):319. doi: 10.1186/s12879-023-08201-3.","Dumchev K","BMC Infect Dis","2023","2023/05/11","PMC10173611","","10.1186/s12879-023-08201-3"
"37363917","Counterfactual estimation of efficacy against placebo for novel PrEP agents using external trial data: example of injectable cabotegravir and oral PrEP in women","Donnell D, Gao F, Hughes JP, Hanscom B, Corey L, Cohen MS, Edupuganti S, Mgodi N, Rees H, Baeten JM, Gray G, Bekker LG, Hosseinipour M, Delany-Moretlwe S.","J Int AIDS Soc. 2023 Jun;26(6):e26118. doi: 10.1002/jia2.26118.","Donnell D","J Int AIDS Soc","2023","2023/06/26","PMC10292682","","10.1002/jia2.26118"
"36995219","Extended Analysis of HIV Infection in Cisgender Men and Transgender Women Who Have Sex with Men Receiving Injectable Cabotegravir for HIV Prevention: HPTN 083","Marzinke MA, Fogel JM, Wang Z, Piwowar-Manning E, Kofron R, Moser A, Bhandari P, Gollings R, Bushman LR, Weng L, Halvas EK, Mellors J, Anderson PL, Persaud D, Hendrix CW, McCauley M, Rinehart AR, St Clair M, Ford SL, Rooney JF, Adeyeye A, Chariyalertsak S, Mayer K, Arduino RC, Cohen MS, Grinsztejn B, Hanscom B, Landovitz RJ, Eshleman SH.","Antimicrob Agents Chemother. 2023 Apr 18;67(4):e0005323. doi: 10.1128/aac.00053-23. Epub 2023 Mar 30.","Marzinke MA","Antimicrob Agents Chemother","2023","2023/03/30","PMC10112247","","10.1128/aac.00053-23"
"37439080","Population-level impact of expanding PrEP coverage by offering long-acting injectable PrEP to MSM in three high-resource settings: a model comparison analysis","Stansfield SE, Heitner J, Mitchell KM, Doyle CM, Milwid RM, Moore M, Donnell DJ, Hanscom B, Xia Y, Maheu-Giroux M, Vijver DV, Wang H, Barnabas R, Boily MC, Dimitrov DT.","J Int AIDS Soc. 2023 Jul;26 Suppl 2(Suppl 2):e26109. doi: 10.1002/jia2.26109.","Stansfield SE","J Int AIDS Soc","2023","2023/07/13","PMC10339001","","10.1002/jia2.26109"
"27480454","Social Network Factors as Correlates and Predictors of High Depressive Symptoms Among Black Men Who Have Sex with Men in HPTN 061","Latkin CA, Van Tieu H, Fields S, Hanscom BS, Connor M, Hanscom B, Hussen SA, Scott HM, Mimiaga MJ, Wilton L, Magnus M, Chen I, Koblin BA.","AIDS Behav. 2017 Apr;21(4):1163-1170. doi: 10.1007/s10461-016-1493-8.","Latkin CA","AIDS Behav","2017","2016/08/03","PMC5288401","NIHMS807664","10.1007/s10461-016-1493-8"
"30600453","Use of Antiretroviral Drug Testing to Assess the Accuracy of Self-reported Data from HIV-Infected People Who Inject Drugs","Fogel JM, Zhang Y, Palumbo PJ, Guo X, Clarke W, Breaud A, Richardson P, Piwowar-Manning E, Hamilton EL, Ha TV, Dumchev K, Djoerban Z, Hoffman I, Hanscom B, Miller WC, Eshleman SH.","AIDS Behav. 2019 Aug;23(8):2101-2108. doi: 10.1007/s10461-018-2379-8.","Fogel JM","AIDS Behav","2019","2019/01/03","PMC6602865","NIHMS1517685","10.1007/s10461-018-2379-8"
"29316523","Gender and race as correlates of high risk sex behaviors among injection drug users at risk for HIV enrolled in the HPTN 037 study","Hill MJ, Holt M, Hanscom B, Wang Z, Cardenas-Turanzas M, Latkin C.","Drug Alcohol Depend. 2018 Feb 1;183:267-274. doi: 10.1016/j.drugalcdep.2017.11.018. Epub 2018 Jan 4.","Hill MJ","Drug Alcohol Depend","2018","2018/01/10","PMC5803307","NIHMS932916","10.1016/j.drugalcdep.2017.11.018"
"18306393","Proxy perspectives regarding end-of-life care for persons with cancer","Bakitas M, Ahles TA, Skalla K, Brokaw FC, Byock I, Hanscom B, Lyons KD, Hegel MT; ENABLE project team.","Cancer. 2008 Apr 15;112(8):1854-61. doi: 10.1002/cncr.23381.","Bakitas M","Cancer","2008","2008/02/29","PMC3638939","NIHMS460368","10.1002/cncr.23381"
"12195074","Computerized questionnaires and the quality of survey data","Hanscom B, Lurie JD, Homa K, Weinstein JN.","Spine (Phila Pa 1976). 2002 Aug 15;27(16):1797-801. doi: 10.1097/00007632-200208150-00020.","Hanscom B","Spine (Phila Pa 1976)","2002","2002/08/27","","","10.1097/00007632-200208150-00020"
"18504093","Reliability and validity of the Functional Assessment of Chronic Illness Therapy-Palliative care (FACIT-Pal) scale","Lyons KD, Bakitas M, Hegel MT, Hanscom B, Hull J, Ahles TA.","J Pain Symptom Manage. 2009 Jan;37(1):23-32. doi: 10.1016/j.jpainsymman.2007.12.015. Epub 2008 May 27.","Lyons KD","J Pain Symptom Manage","2009","2008/05/28","PMC2746408","NIHMS88516","10.1016/j.jpainsymman.2007.12.015"
"29186421","Expanding Hospital Human Immunodeficiency Virus Testing in the Bronx, New York and Washington, District of Columbia: Results From the HPTN 065 Study","Branson BM, Chavez PR, Hanscom B, Greene E, McKinstry L, Buchacz K, Beauchamp G, Gamble T, Zingman BS, Telzak E, Naab T, Fitzpatrick L, El-Sadr WM; HIV Prevention Trials Network (HPTN) 065 Study Team.","Clin Infect Dis. 2018 May 2;66(10):1581-1587. doi: 10.1093/cid/cix1053.","Branson BM","Clin Infect Dis","2018","2017/11/30","PMC5930256","NIHMS926429","10.1093/cid/cix1053"
"31600343","HIV drug resistance in persons who inject drugs enrolled in an HIV prevention trial in Indonesia, Ukraine, and Vietnam: HPTN 074","Palumbo PJ, Zhang Y, Fogel JM, Guo X, Clarke W, Breaud A, Richardson P, Piwowar-Manning E, Hart S, Hamilton EL, Hoa NTK, Liulchuk M, Anandari L, Ha TV, Dumchev K, Djoerban Z, Hoffman I, Hanscom B, Miller WC, Eshleman SH.","PLoS One. 2019 Oct 10;14(10):e0223829. doi: 10.1371/journal.pone.0223829. eCollection 2019.","Palumbo PJ","PLoS One","2019","2019/10/11","PMC6786608","","10.1371/journal.pone.0223829"
"20837957","Longitudinal assessment of cognitive changes associated with adjuvant treatment for breast cancer: impact of age and cognitive reserve","Ahles TA, Saykin AJ, McDonald BC, Li Y, Furstenberg CT, Hanscom BS, Mulrooney TJ, Schwartz GN, Kaufman PA.","J Clin Oncol. 2010 Oct 10;28(29):4434-40. doi: 10.1200/JCO.2009.27.0827. Epub 2010 Sep 13.","Ahles TA","J Clin Oncol","2010","2010/09/15","PMC2988635","","10.1200/JCO.2009.27.0827"
"12045523","Three-question depression screener used for lumbar disc herniations and spinal stenosis","Levy HI, Hanscom B, Boden SD.","Spine (Phila Pa 1976). 2002 Jun 1;27(11):1232-7. doi: 10.1097/00007632-200206010-00017.","Levy HI","Spine (Phila Pa 1976)","2002","2002/06/05","","","10.1097/00007632-200206010-00017"
"30350406","Regional differences between people who inject drugs in an HIV prevention trial integrating treatment and prevention (HPTN 074): a baseline analysis","Lancaster KE, Hoffman IF, Hanscom B, Ha TV, Dumchev K, Susami H, Rose S, Go VF, Reifeis SA, Mollan KR, Hudgens MG, Piwowar-Manning EM, Richardson P, Dvoriak S, Djoerban Z, Kiriazova T, Zeziulin O, Djauzi S, Ahn CV, Latkin C, Metzger D, Burns DN, Sugarman J, Strathdee SA, Eshleman SH, Clarke W, Donnell D, Emel L, Sunner LE, McKinstry L, Sista N, Hamilton EL, Lucas JP, Duong BD, Van Vuong N, Sarasvita R, Miller WC; HPTN 074 Study Team.","J Int AIDS Soc. 2018 Oct;21(10):e25195. doi: 10.1002/jia2.25195.","Lancaster KE","J Int AIDS Soc","2018","2018/10/24","PMC6198168","","10.1002/jia2.25195"
"17674194","Cognitive function in breast cancer patients prior to adjuvant treatment","Ahles TA, Saykin AJ, McDonald BC, Furstenberg CT, Cole BF, Hanscom BS, Mulrooney TJ, Schwartz GN, Kaufman PA.","Breast Cancer Res Treat. 2008 Jul;110(1):143-52. doi: 10.1007/s10549-007-9686-5. Epub 2007 Aug 3.","Ahles TA","Breast Cancer Res Treat","2008","2007/08/04","PMC3114441","NIHMS128555","10.1007/s10549-007-9686-5"
"17700451","What is different about workers' compensation patients? Socioeconomic predictors of baseline disability status among patients with lumbar radiculopathy","Atlas SJ, Tosteson TD, Hanscom B, Blood EA, Pransky GS, Abdu WA, Andersson GB, Weinstein JN.","Spine (Phila Pa 1976). 2007 Aug 15;32(18):2019-26. doi: 10.1097/BRS.0b013e318133d69b.","Atlas SJ","Spine (Phila Pa 1976)","2007","2007/08/19","PMC2860950","NIHMS190357","10.1097/BRS.0b013e318133d69b"
"16517382","The impact of four common lumbar spine diagnoses upon overall health status","Pahl MA, Brislin B, Boden S, Hilibrand AS, Vaccaro A, Hanscom B, Albert TJ.","Spine J. 2006 Mar-Apr;6(2):125-30. doi: 10.1016/j.spinee.2005.04.014. Epub 2006 Feb 3.","Pahl MA","Spine J","2006","2006/03/07","","","10.1016/j.spinee.2005.04.014"
"18777603","The cost effectiveness of surgical versus nonoperative treatment for lumbar disc herniation over two years: evidence from the Spine Patient Outcomes Research Trial (SPORT)","Tosteson AN, Skinner JS, Tosteson TD, Lurie JD, Andersson GB, Berven S, Grove MR, Hanscom B, Blood EA, Weinstein JN.","Spine (Phila Pa 1976). 2008 Sep 1;33(19):2108-15. doi: 10.1097/brs.0b013e318182e390.","Tosteson AN","Spine (Phila Pa 1976)","2008","2008/09/09","PMC2883775","NIHMS140559","10.1097/brs.0b013e318182e390"
"11805698","Influence of smoking on the health status of spinal patients: the National Spine Network database","Vogt MT, Hanscom B, Lauerman WC, Kang JD.","Spine (Phila Pa 1976). 2002 Feb 1;27(3):313-9. doi: 10.1097/00007632-200202010-00022.","Vogt MT","Spine (Phila Pa 1976)","2002","2002/01/24","","","10.1097/00007632-200202010-00022"
"16651227","Screening for depressive symptoms in patients with chronic spinal pain using the SF-36 Health Survey","Walsh TL, Homa K, Hanscom B, Lurie J, Sepulveda MG, Abdu W.","Spine J. 2006 May-Jun;6(3):316-20. doi: 10.1016/j.spinee.2005.11.004.","Walsh TL","Spine J","2006","2006/05/03","","","10.1016/j.spinee.2005.11.004"
"14520044","Cluster analysis classification of SF-36 profiles for patients with spinal pain","Fanciullo GJ, Hanscom B, Weinstein JN, Chawarski MC, Jamison RN, Baird JC.","Spine (Phila Pa 1976). 2003 Oct 1;28(19):2276-82. doi: 10.1097/01.BRS.0000084880.33281.EB.","Fanciullo GJ","Spine (Phila Pa 1976)","2003","2003/10/02","","","10.1097/01.BRS.0000084880.33281.EB"
"17119141","Surgical vs nonoperative treatment for lumbar disk herniation: the Spine Patient Outcomes Research Trial (SPORT) observational cohort","Weinstein JN, Lurie JD, Tosteson TD, Skinner JS, Hanscom B, Tosteson AN, Herkowitz H, Fischgrund J, Cammisa FP, Albert T, Deyo RA.","JAMA. 2006 Nov 22;296(20):2451-9. doi: 10.1001/jama.296.20.2451.","Weinstein JN","JAMA","2006","2006/11/23","PMC2562254","NIHMS67263","10.1001/jama.296.20.2451"
"11805697","Association between obesity and functional status in patients with spine disease","Fanuele JC, Abdu WA, Hanscom B, Weinstein JN.","Spine (Phila Pa 1976). 2002 Feb 1;27(3):306-12. doi: 10.1097/00007632-200202010-00021.","Fanuele JC","Spine (Phila Pa 1976)","2002","2002/01/24","","","10.1097/00007632-200202010-00021"
"16582855","Descriptive epidemiology and prior healthcare utilization of patients in the Spine Patient Outcomes Research Trial's (SPORT) three observational cohorts: disc herniation, spinal stenosis, and degenerative spondylolisthesis","Cummins J, Lurie JD, Tosteson TD, Hanscom B, Abdu WA, Birkmeyer NJ, Herkowitz H, Weinstein J.","Spine (Phila Pa 1976). 2006 Apr 1;31(7):806-14. doi: 10.1097/01.brs.0000207473.09030.0d.","Cummins J","Spine (Phila Pa 1976)","2006","2006/04/04","PMC2775468","NIHMS140779","10.1097/01.brs.0000207473.09030.0d"
"16825051","Prospective clinical outcomes of revision fusion surgery in patients with pseudarthrosis after posterior lumbar interbody fusions using stand-alone metallic cages","Cassinelli EH, Wallach C, Hanscom B, Vogt M, Kang JD.","Spine J. 2006 Jul-Aug;6(4):428-34. doi: 10.1016/j.spinee.2005.11.003.","Cassinelli EH","Spine J","2006","2006/07/11","","","10.1016/j.spinee.2005.11.003"
"15682020","Differences in the work-up and treatment of conditions associated with low back pain by patient gender and ethnic background","Taylor BA, Casas-Ganem J, Vaccaro AR, Hilibrand AS, Hanscom BS, Albert TJ.","Spine (Phila Pa 1976). 2005 Feb 1;30(3):359-64. doi: 10.1097/01.brs.0000152115.79236.6e.","Taylor BA","Spine (Phila Pa 1976)","2005","2005/02/01","","","10.1097/01.brs.0000152115.79236.6e"
"11805668","An observational study on the prevalence and pattern of opioid use in 25,479 patients with spine and radicular pain","Fanciullo GJ, Ball PA, Girault G, Rose RJ, Hanscom B, Weinstein JN.","Spine (Phila Pa 1976). 2002 Jan 15;27(2):201-5. doi: 10.1097/00007632-200201150-00016.","Fanciullo GJ","Spine (Phila Pa 1976)","2002","2002/01/24","","","10.1097/00007632-200201150-00016"
"15471657","Psychometric update of the Functional Interference Estimate: a brief measure of pain functional interference","Ferguson RJ, Seville J, Cole B, Hanscom B, Wasson JH, Johnson DJ, Ahles T.","J Pain Symptom Manage. 2004 Oct;28(4):389-95. doi: 10.1016/j.jpainsymman.2004.01.011.","Ferguson RJ","J Pain Symptom Manage","2004","2004/10/09","","","10.1016/j.jpainsymman.2004.01.011"
"12642770","Is a condition-specific instrument for patients with low back pain/leg symptoms really necessary? The responsiveness of the Oswestry Disability Index, MODEMS, and the SF-36","Walsh TL, Hanscom B, Lurie JD, Weinstein JN.","Spine (Phila Pa 1976). 2003 Mar 15;28(6):607-15. doi: 10.1097/01.BRS.0000050654.97387.DF.","Walsh TL","Spine (Phila Pa 1976)","2003","2003/03/19","","","10.1097/01.BRS.0000050654.97387.DF"
